[
  {
    "episode_id": "ep_recent_validation_failure",
    "event_type": "validation_result",
    "summary": "A recent schema update required the prompt and schema to be corrected together before validation passed.",
    "status": "observed",
    "scope_type": "repo",
    "scope_value": "rktkdduq01/Long-term-memory",
    "created_at": "2026-04-23T08:45:00Z",
    "related_files": [
      "prompts/resolve-memory-conflicts.md",
      "schemas/conflict-action.schema.json"
    ],
    "evidence_refs": [
      {
        "source_type": "manual_review",
        "source_id": "memory-review-2026-04-23",
        "quote_or_summary": "Prompt and schema drift caused validation failure until both were aligned.",
        "observed_at": "2026-04-23T08:45:00Z",
        "trust_level": "partially_trusted"
      }
    ],
    "linked_memories": [
      "mem_repo_schema_rule"
    ]
  }
]
